pdf_file,image_file,image_path,page,caption,keywords,similarity_scores
ref_8b.pdf,img_p6_37_20250706001150907334.jpeg,D:/STUDY/CODE/Paper_retrieval/paper\extracted_images\img_p6_37_20250706001150907334.jpeg,6,Figure S2.  Discharge rate performance of LMR half cells in LDME2 and carbonate electrolytes.  a)  Variable discharge rate cycling performance when after charging at C/10. Associated  discharge profiles in  b)  carbonate and  c)  LDME2 electrolytes.,conductivity; viscosities; capacity retention; cycling performance; coulombic efficiency; coulombic efficiencies; conductivities; electrolyte; viscosity; lithium metal,0.745; 0.731; 0.690; 0.678; 0.597; 0.597; 0.594; 0.582; 0.549; 0.428
ref_8b.pdf,img_p7_41_20250706001150932945.jpeg,D:/STUDY/CODE/Paper_retrieval/paper\extracted_images\img_p7_41_20250706001150932945.jpeg,7,Figure S3.  Scanning electron microscopy of Li counter electrodes after 100 cycles in half cells.  Morphology of Li cycled in the carbonate electrolyte from  a)  top and  b)  cross-sectional views.  Morphology of Li cycled in the LDME2 electrolyte from  c)  top and  d)  cross-sectional views.,conductivity; viscosities; cycling performance; capacity retention; electrolyte; conductivities; coulombic efficiency; coulombic efficiencies; viscosity; lithium metal,0.734; 0.717; 0.641; 0.629; 0.599; 0.586; 0.545; 0.545; 0.517; 0.452
ref_8b.pdf,img_p8_45_20250706001150966740.jpeg,D:/STUDY/CODE/Paper_retrieval/paper\extracted_images\img_p8_45_20250706001150966740.jpeg,8,Figure S4.  Additional electrochemical data of full cells shown in Figure 4d. Voltage curves  from cells applying  a)  Carbonate and  b)  LDME2 electrolytes. Corresponding dQ dV -1  discharge  curves from cells applying  c)  Carbonate and  d)  LDME2 electrolytes.,conductivity; viscosities; electrolyte; capacity retention; cycling performance; viscosity; coulombic efficiency; coulombic efficiencies; conductivities; lithium metal,0.692; 0.688; 0.613; 0.605; 0.579; 0.572; 0.552; 0.552; 0.534; 0.438
ref_8b.pdf,img_p9_49_20250706001150998386.jpeg,D:/STUDY/CODE/Paper_retrieval/paper\extracted_images\img_p9_49_20250706001150998386.jpeg,9,Figure S5.  XPS C1s spectra of Li counter electrodes after 1 cycle in  a)  carbonate and  b)   LDME2 electrolytes. C1s spectra of Li counter electrodes after 100 cycle in  c)  carbonate and  d)  LDME2 electrolytes.,conductivity; viscosities; electrolyte; capacity retention; cycling performance; conductivities; coulombic efficiency; coulombic efficiencies; viscosity; lithium metal; anode; cathode,0.683; 0.659; 0.587; 0.572; 0.567; 0.519; 0.513; 0.513; 0.481; 0.427; 0.403; 0.403
ref_8b.pdf,img_p10_53_20250706001151098401.png,D:/STUDY/CODE/Paper_retrieval/paper\extracted_images\img_p10_53_20250706001151098401.png,10,Figure S6.  XPS F1s spectra of Li counter electrodes after 1 cycle in  a)  carbonate and  b)  LDME2  electrolytes. F1s spectra of Li counter electrodes after 100 cycle in  c)  carbonate and  d)  LDME2  electrolytes.,conductivity; viscosities; electrolyte; capacity retention; cycling performance; conductivities; coulombic efficiency; coulombic efficiencies; viscosity; lithium metal; anode; cathode,0.690; 0.661; 0.584; 0.573; 0.565; 0.518; 0.509; 0.509; 0.477; 0.425; 0.400; 0.400
ref_8b.pdf,img_p11_57_20250706001151132486.jpeg,D:/STUDY/CODE/Paper_retrieval/paper\extracted_images\img_p11_57_20250706001151132486.jpeg,11,Figure S7.  XPS C1s spectra of LMR cathodes taken from half cells after 1 cycle in  a)  carbonate  and  b)  LDME2 electrolytes. C1s spectra of LMR cathodes after 100 cycles in half cells using  c)  carbonate and  d)  LDME2 electrolytes.,conductivity; viscosities; electrolyte; capacity retention; cycling performance; conductivities; coulombic efficiency; coulombic efficiencies; viscosity; lithium metal,0.696; 0.682; 0.607; 0.598; 0.584; 0.530; 0.519; 0.519; 0.518; 0.431
ref_8b.pdf,img_p12_61_20250706001151163299.jpeg,D:/STUDY/CODE/Paper_retrieval/paper\extracted_images\img_p12_61_20250706001151163299.jpeg,12,Figure S8.  XPS F1s spectra of LMR cathodes taken from half cells after 1 cycle in  a)  carbonate  and  b)  LDME2 electrolytes. F1s spectra of LMR cathodes after 100 cycles in half cells using  c)  carbonate and  d)  LDME2 electrolytes.,conductivity; viscosities; electrolyte; capacity retention; cycling performance; conductivities; coulombic efficiency; coulombic efficiencies; viscosity; lithium metal,0.704; 0.685; 0.606; 0.601; 0.585; 0.530; 0.517; 0.517; 0.516; 0.430
